{
  "schema_version": "v3",
  "review_id": "review.v3.hr.current.sickness-reporting",
  "review_version": "3",
  "benchmark_id": "dolved-care-engineering",
  "corpus_version": "3",
  "taxonomy": {
    "taxonomy_id": "dolved-care-engineering-taxonomy",
    "taxonomy_version": "1",
    "taxonomy_sha256": "4f4d17654f2a510a70b640abf794ddefd1e5b84990c150f5a3dff9a7bf203af5"
  },
  "case_id": "v3.hr.current.sickness-reporting",
  "case_sha256": "2e009029c30de78f6f5d994c00887d7504c9ae435c0ea9edf20f9d9c74908bcb",
  "source_catalog_digest": "4b6864760d735f5b59ec7027e2e6006d21435fb738d366d5d52e78fd48a3ae6e",
  "source_lineage_digest": "05cced121d89bbb4fec7f5004eb478bffc79b4261b489a5371922da9dceb3cec",
  "evidence_unit_ids_digest": "fd961e854ab021c2744f64a2d9370c93fb9cd119c98e6b0c0a0ac4678dc5ca27",
  "reviewed_at": "2026-08-13T22:45:00Z",
  "machine_validation": {
    "validator_id": "benchmark-v3-compiler",
    "validator_version": "1",
    "passed": true
  },
  "human_review": {
    "source_truth": "REVIEWED",
    "evidence_units": "REVIEWED",
    "expected_outcome": "REVIEWED",
    "temporal_facts": "REVIEWED",
    "applicability_facts": "REVIEWED",
    "controlled_rejection_rationale": "NOT_APPLICABLE",
    "approved": true
  },
  "reviewer_identity": "codex",
  "review_note": "Calibration authoring review confirmed source truth, question-to-evidence scope, temporal and applicability facts, and controlled-outcome rationale."
}
