{
  "schema_version": "v3",
  "review_id": "review.v3.training.current.fire-marshal-refresh",
  "review_version": "1",
  "benchmark_id": "dolved-care-engineering",
  "corpus_version": "3",
  "taxonomy": {
    "taxonomy_id": "dolved-care-engineering-taxonomy",
    "taxonomy_version": "1",
    "taxonomy_sha256": "4f4d17654f2a510a70b640abf794ddefd1e5b84990c150f5a3dff9a7bf203af5"
  },
  "case_id": "v3.training.current.fire-marshal-refresh",
  "case_sha256": "c21fb759aa472b3bd79e507fb972880559e495459ef4de93ce9c2ba49208e054",
  "source_catalog_digest": "bc1876ad8d4e15f30c638021c5cf3d3d719c5ca694e52090614db58005a006fc",
  "source_lineage_digest": "c8c19b37670a28ea4728016f818b0faab30b2a866ef96910216983d79f449f07",
  "evidence_unit_ids_digest": "b2c57a526a680070eba141715b4be595f83996d6124384626b42f7f521ce428a",
  "reviewer_identity": "codex",
  "reviewed_at": "2026-08-15T12:00:00Z",
  "review_note": "Mechanical V2 engineering migration reviewed for unchanged source truth, V3 taxonomy binding, evidence anchoring, temporal scope and applicability.",
  "machine_validation": {
    "validator_id": "benchmark-v3-compiler",
    "validator_version": "1",
    "passed": true
  },
  "human_review": {
    "source_truth": "REVIEWED",
    "evidence_units": "REVIEWED",
    "expected_outcome": "REVIEWED",
    "temporal_facts": "REVIEWED",
    "applicability_facts": "REVIEWED",
    "controlled_rejection_rationale": "NOT_APPLICABLE",
    "approved": true
  }
}
