{
  "schema_version": "v3",
  "review_id": "review.v3.medication.current.omitted-dose",
  "review_version": "3",
  "benchmark_id": "dolved-care-engineering",
  "corpus_version": "3",
  "taxonomy": {
    "taxonomy_id": "dolved-care-engineering-taxonomy",
    "taxonomy_version": "1",
    "taxonomy_sha256": "4f4d17654f2a510a70b640abf794ddefd1e5b84990c150f5a3dff9a7bf203af5"
  },
  "case_id": "v3.medication.current.omitted-dose",
  "case_sha256": "094a66863a72a9ef0cb9db15def903196568eade49c7f02fa5188df6e1e6558b",
  "source_catalog_digest": "bc1876ad8d4e15f30c638021c5cf3d3d719c5ca694e52090614db58005a006fc",
  "source_lineage_digest": "2ea1ae7a92283bb014de4331757af22073166d1531f3f146fd6492b91a6109e2",
  "evidence_unit_ids_digest": "23dd0d7553fb4d3cc386a12da956bf39c025054e09d77fecaaba5c4bdeaf995c",
  "reviewed_at": "2026-08-13T22:45:00Z",
  "machine_validation": {
    "validator_id": "benchmark-v3-compiler",
    "validator_version": "1",
    "passed": true
  },
  "human_review": {
    "source_truth": "REVIEWED",
    "evidence_units": "REVIEWED",
    "expected_outcome": "REVIEWED",
    "temporal_facts": "REVIEWED",
    "applicability_facts": "REVIEWED",
    "controlled_rejection_rationale": "NOT_APPLICABLE",
    "approved": true
  },
  "reviewer_identity": "codex",
  "review_note": "Calibration authoring review confirmed source truth, question-to-evidence scope, temporal and applicability facts, and controlled-outcome rationale."
}
