{
  "schema_version": "v3",
  "review_id": "review.v3.infection.historical.hand-hygiene-v1",
  "review_version": "3",
  "benchmark_id": "dolved-care-engineering",
  "corpus_version": "3",
  "taxonomy": {
    "taxonomy_id": "dolved-care-engineering-taxonomy",
    "taxonomy_version": "1",
    "taxonomy_sha256": "4f4d17654f2a510a70b640abf794ddefd1e5b84990c150f5a3dff9a7bf203af5"
  },
  "case_id": "v3.infection.historical.hand-hygiene-v1",
  "case_sha256": "dd39b8f45f9367404d01dfc7fd3de98412a43dc7bb90a65ac407e18a88f7628c",
  "source_catalog_digest": "bc1876ad8d4e15f30c638021c5cf3d3d719c5ca694e52090614db58005a006fc",
  "source_lineage_digest": "d908b23e2c4090b433ac08bdfe8a5a80ac9659b6d671124d74a12afd12efad75",
  "evidence_unit_ids_digest": "29d215e01b8cc59b9e631da1a3c3e7e5ad5906e995adf82a3097a9df57b9c2b1",
  "reviewed_at": "2026-08-13T22:45:00Z",
  "machine_validation": {
    "validator_id": "benchmark-v3-compiler",
    "validator_version": "1",
    "passed": true
  },
  "human_review": {
    "source_truth": "REVIEWED",
    "evidence_units": "REVIEWED",
    "expected_outcome": "REVIEWED",
    "temporal_facts": "REVIEWED",
    "applicability_facts": "REVIEWED",
    "controlled_rejection_rationale": "NOT_APPLICABLE",
    "approved": true
  },
  "reviewer_identity": "codex",
  "review_note": "Calibration authoring review confirmed source truth, question-to-evidence scope, temporal and applicability facts, and controlled-outcome rationale."
}
