{
  "schema_version": "v3",
  "review_id": "review.v3.complaints.compare.handling-timescales",
  "review_version": "3",
  "benchmark_id": "dolved-care-engineering",
  "corpus_version": "3",
  "taxonomy": {
    "taxonomy_id": "dolved-care-engineering-taxonomy",
    "taxonomy_version": "1",
    "taxonomy_sha256": "4f4d17654f2a510a70b640abf794ddefd1e5b84990c150f5a3dff9a7bf203af5"
  },
  "case_id": "v3.complaints.compare.handling-timescales",
  "case_sha256": "f7bc7e66a3787f7b68268cb4fd5af6c67ade650b12b7f57c01912849209a1363",
  "source_catalog_digest": "4b6864760d735f5b59ec7027e2e6006d21435fb738d366d5d52e78fd48a3ae6e",
  "source_lineage_digest": "fb566b966ff011370ad3053dc5fb14456c87c42630f74ca7452388758fd2979a",
  "evidence_unit_ids_digest": "cd7c6f84f83bb7680d9f54731c096d429db2edee699662a67a8e07c1a390d6ba",
  "reviewed_at": "2026-08-13T22:45:00Z",
  "machine_validation": {
    "validator_id": "benchmark-v3-compiler",
    "validator_version": "1",
    "passed": true
  },
  "human_review": {
    "source_truth": "REVIEWED",
    "evidence_units": "REVIEWED",
    "expected_outcome": "REVIEWED",
    "temporal_facts": "REVIEWED",
    "applicability_facts": "REVIEWED",
    "controlled_rejection_rationale": "NOT_APPLICABLE",
    "approved": true
  },
  "reviewer_identity": "codex",
  "review_note": "Calibration authoring review confirmed source truth, question-to-evidence scope, temporal and applicability facts, and controlled-outcome rationale."
}
