{
  "schema_version": "v3",
  "review_id": "review.v3.complaints.historical.handling-v1",
  "review_version": "3",
  "benchmark_id": "dolved-care-engineering",
  "corpus_version": "3",
  "taxonomy": {
    "taxonomy_id": "dolved-care-engineering-taxonomy",
    "taxonomy_version": "1",
    "taxonomy_sha256": "4f4d17654f2a510a70b640abf794ddefd1e5b84990c150f5a3dff9a7bf203af5"
  },
  "case_id": "v3.complaints.historical.handling-v1",
  "case_sha256": "f6965c0572c3195b934ddabd4f6522885c39e62ec11ae43ac5bebfd7ba062c07",
  "source_catalog_digest": "4b6864760d735f5b59ec7027e2e6006d21435fb738d366d5d52e78fd48a3ae6e",
  "source_lineage_digest": "1fc7ce659225db5cafbd92d904a0e1aa64c830994934223751df3be596c38efd",
  "evidence_unit_ids_digest": "fe48c14a4bd7c6df333e987ddad078e50b12fd4cdaf68c6e65eb3c05516047fc",
  "reviewed_at": "2026-08-13T22:45:00Z",
  "machine_validation": {
    "validator_id": "benchmark-v3-compiler",
    "validator_version": "1",
    "passed": true
  },
  "human_review": {
    "source_truth": "REVIEWED",
    "evidence_units": "REVIEWED",
    "expected_outcome": "REVIEWED",
    "temporal_facts": "REVIEWED",
    "applicability_facts": "REVIEWED",
    "controlled_rejection_rationale": "NOT_APPLICABLE",
    "approved": true
  },
  "reviewer_identity": "codex",
  "review_note": "Calibration authoring review confirmed source truth, question-to-evidence scope, temporal and applicability facts, and controlled-outcome rationale."
}
