{
  "schema_version": "v3",
  "review_id": "review.v3.fire.current.north-west-assembly",
  "review_version": "3",
  "benchmark_id": "dolved-care-engineering",
  "corpus_version": "3",
  "taxonomy": {
    "taxonomy_id": "dolved-care-engineering-taxonomy",
    "taxonomy_version": "1",
    "taxonomy_sha256": "4f4d17654f2a510a70b640abf794ddefd1e5b84990c150f5a3dff9a7bf203af5"
  },
  "case_id": "v3.fire.current.north-west-assembly",
  "case_sha256": "d55b2a147c05adc82fbf3d949418c1c7c9b912aa891561d8374c0b76c0ae24ad",
  "source_catalog_digest": "bc1876ad8d4e15f30c638021c5cf3d3d719c5ca694e52090614db58005a006fc",
  "source_lineage_digest": "f2ee9e3e36ecb331a3061938615d9a83e926bcd70a1cd196ac4c56298f5759fe",
  "evidence_unit_ids_digest": "98e2785026381556ad62daa16497fd494eb51252845b7963da9f78b44abcaa23",
  "reviewed_at": "2026-08-13T22:45:00Z",
  "machine_validation": {
    "validator_id": "benchmark-v3-compiler",
    "validator_version": "1",
    "passed": true
  },
  "human_review": {
    "source_truth": "REVIEWED",
    "evidence_units": "REVIEWED",
    "expected_outcome": "REVIEWED",
    "temporal_facts": "REVIEWED",
    "applicability_facts": "REVIEWED",
    "controlled_rejection_rationale": "NOT_APPLICABLE",
    "approved": true
  },
  "reviewer_identity": "codex",
  "review_note": "Calibration authoring review confirmed source truth, question-to-evidence scope, temporal and applicability facts, and controlled-outcome rationale."
}
