{
  "schema_version": "v3",
  "review_id": "review.v3.health.insufficient.lone-working-police-time",
  "review_version": "3",
  "benchmark_id": "dolved-care-engineering",
  "corpus_version": "3",
  "taxonomy": {
    "taxonomy_id": "dolved-care-engineering-taxonomy",
    "taxonomy_version": "1",
    "taxonomy_sha256": "4f4d17654f2a510a70b640abf794ddefd1e5b84990c150f5a3dff9a7bf203af5"
  },
  "case_id": "v3.health.insufficient.lone-working-police-time",
  "case_sha256": "4d690704cb7c29f935e0580b02bf27baf226b04e278e6e4a24af6331bd5f94ba",
  "source_catalog_digest": "bc1876ad8d4e15f30c638021c5cf3d3d719c5ca694e52090614db58005a006fc",
  "source_lineage_digest": "fbbdb8378b1fa4d9b2d3b0a67131e0ae3d719ebdb05cba6d1446f7cfd389b709",
  "evidence_unit_ids_digest": "4f53cda18c2baa0c0354bb5f9a3ecbe5ed12ab4d8e11ba873c2f11161202b945",
  "reviewed_at": "2026-08-13T22:45:00Z",
  "machine_validation": {
    "validator_id": "benchmark-v3-compiler",
    "validator_version": "1",
    "passed": true
  },
  "human_review": {
    "source_truth": "REVIEWED",
    "evidence_units": "REVIEWED",
    "expected_outcome": "REVIEWED",
    "temporal_facts": "REVIEWED",
    "applicability_facts": "REVIEWED",
    "controlled_rejection_rationale": "REVIEWED",
    "approved": true
  },
  "reviewer_identity": "codex",
  "review_note": "Calibration authoring review confirmed source truth, question-to-evidence scope, temporal and applicability facts, and controlled-outcome rationale."
}
