{
  "schema_version": "v3",
  "review_id": "review.v3.health.current.coshh-review-trigger",
  "review_version": "1",
  "benchmark_id": "dolved-care-engineering",
  "corpus_version": "3",
  "taxonomy": {
    "taxonomy_id": "dolved-care-engineering-taxonomy",
    "taxonomy_version": "1",
    "taxonomy_sha256": "4f4d17654f2a510a70b640abf794ddefd1e5b84990c150f5a3dff9a7bf203af5"
  },
  "case_id": "v3.health.current.coshh-review-trigger",
  "case_sha256": "fba5e75a971d5379aa6f98260219e0e296ffbb1d6a970aa3378fed95980e5e94",
  "source_catalog_digest": "bc1876ad8d4e15f30c638021c5cf3d3d719c5ca694e52090614db58005a006fc",
  "source_lineage_digest": "d166d0dc80c21170d65302c90a09d612837a643fdfb26facb965bcfa6682de12",
  "evidence_unit_ids_digest": "4ca72c883db78de81ceb00b8f1554a813e9ea0f66c44607dd0c76f0564332073",
  "reviewer_identity": "codex",
  "reviewed_at": "2026-08-15T12:00:00Z",
  "review_note": "Mechanical V2 engineering migration reviewed for unchanged source truth, V3 taxonomy binding, evidence anchoring, temporal scope and applicability.",
  "machine_validation": {
    "validator_id": "benchmark-v3-compiler",
    "validator_version": "1",
    "passed": true
  },
  "human_review": {
    "source_truth": "REVIEWED",
    "evidence_units": "REVIEWED",
    "expected_outcome": "REVIEWED",
    "temporal_facts": "REVIEWED",
    "applicability_facts": "REVIEWED",
    "controlled_rejection_rationale": "NOT_APPLICABLE",
    "approved": true
  }
}
