{
  "schema_version": "v3",
  "review_id": "review.v3.medication.valid-at-date.omitted-dose-2024",
  "review_version": "3",
  "benchmark_id": "dolved-care-engineering",
  "corpus_version": "3",
  "taxonomy": {
    "taxonomy_id": "dolved-care-engineering-taxonomy",
    "taxonomy_version": "1",
    "taxonomy_sha256": "4f4d17654f2a510a70b640abf794ddefd1e5b84990c150f5a3dff9a7bf203af5"
  },
  "case_id": "v3.medication.valid-at-date.omitted-dose-2024",
  "case_sha256": "b02b40fe9741ffd3a246959f50b785f60b4fabcf32f1317734ad30971e32b364",
  "source_catalog_digest": "4b6864760d735f5b59ec7027e2e6006d21435fb738d366d5d52e78fd48a3ae6e",
  "source_lineage_digest": "e0535afb74e81d865e8962ab5edc638e2773b7ad69628e404000248a983d3549",
  "evidence_unit_ids_digest": "4231beafb2529350840aa0673a3b3a4774d0ecd5d0a3b208ad277c8d27c0466e",
  "reviewed_at": "2026-08-13T22:45:00Z",
  "machine_validation": {
    "validator_id": "benchmark-v3-compiler",
    "validator_version": "1",
    "passed": true
  },
  "human_review": {
    "source_truth": "REVIEWED",
    "evidence_units": "REVIEWED",
    "expected_outcome": "REVIEWED",
    "temporal_facts": "REVIEWED",
    "applicability_facts": "REVIEWED",
    "controlled_rejection_rationale": "NOT_APPLICABLE",
    "approved": true
  },
  "reviewer_identity": "codex",
  "review_note": "Calibration authoring review confirmed source truth, question-to-evidence scope, temporal and applicability facts, and controlled-outcome rationale."
}
