{
  "schema_version": "v3",
  "review_id": "review.v3.medication.compare.controlled-drugs-discrepancy",
  "review_version": "1",
  "benchmark_id": "dolved-care-engineering",
  "corpus_version": "3",
  "taxonomy": {
    "taxonomy_id": "dolved-care-engineering-taxonomy",
    "taxonomy_version": "1",
    "taxonomy_sha256": "4f4d17654f2a510a70b640abf794ddefd1e5b84990c150f5a3dff9a7bf203af5"
  },
  "case_id": "v3.medication.compare.controlled-drugs-discrepancy",
  "case_sha256": "3250cb01bdd09b35af0b333aa52756890f1318711f388fd1c34747788bcba54f",
  "source_catalog_digest": "4b6864760d735f5b59ec7027e2e6006d21435fb738d366d5d52e78fd48a3ae6e",
  "source_lineage_digest": "3dc6241915e7a6acbc05e88929432b2b08c5db41e7b858f08833256785ca9e07",
  "evidence_unit_ids_digest": "319860da934eaee633ba25c32ff655ce8d896904f895fcd5743a3d751f90e885",
  "reviewed_at": "2026-08-16T12:00:00Z",
  "machine_validation": {
    "validator_id": "benchmark-v3-compiler",
    "validator_version": "1",
    "passed": true
  },
  "human_review": {
    "source_truth": "REVIEWED",
    "evidence_units": "REVIEWED",
    "expected_outcome": "REVIEWED",
    "temporal_facts": "REVIEWED",
    "applicability_facts": "REVIEWED",
    "controlled_rejection_rationale": "NOT_APPLICABLE",
    "approved": true
  },
  "reviewer_identity": "codex",
  "review_note": "Engineering regression review confirms the revised wording explicitly compares historical version 1 with the current procedure, preserves independently source-anchored PRIMARY and COMPARISON evidence, and does not copy calibration wording."
}
